{
  "id": "minecraft-vanilla",
  "category_id": "minecraft",
  "display_name": "Minecraft Vanilla",
  "slot_requirement": 1,
  "support_level": "advanced",
  "image": {
    "repository": "ghcr.io/kimri/minecraft",
    "tag": "1.20.4",
    "tag_policy": "pinned"
  },
  "allowed_modding_profiles": []
}
